src,true_meaning,literal_translation
चोली-दामन का साथ,inseparable relationship,the companionship of blouse and veil
छोटा मुँह बड़ी बात,big talk from a small person,"small mouth, big talk"
जुबान पर ताला लगाना,to keep one’s mouth shut,to put a lock on the tongue
जुबान देना और निभाना,to keep a promise,to give one’s word and keep it
जुबान की कसम,a solemn vow,oath of the tongue
जान पर बन आना,to be in grave danger,to come upon the life
जान हथेली पर लेकर फिरना,to live riskily,to carry one’s life on the palm
जेब ढीली करना,to spend money,to loosen the pocket
जेब काटना,to pickpocket / cheat,to cut the pocket
जोर आज़माइश करना,to test strength,to do strength-testing
जोर-शोर से करना,to do with great enthusiasm,to do with force and noise
टेंट-टून बजना,to make a loud scene (colloq.),to go ‘tain-toon’ (clang loudly)
ठाठ से रहना,to live in style,to live with pomp
डंका पीटना,to announce loudly,to beat the kettle-drum
ढिंढोरा पीटना,to brag publicly,to beat the public drum
ढील देना,to be lenient,to give slack
तारीफ़ के पुल बाँधना,to heap praises,to build bridges of praise
तह तक पहुँचना,to get to the root cause,to reach the bottom layer
तन-मन-धन से,"with body, mind, and wealth; wholeheartedly","with body, mind, and wealth"
तार-तार करना,to tear apart reputation,to make into threads
तार जोड़ना,to connect the dots,to join the wires
तीस मार खाँ,a self-proclaimed hero; boaster,Tees Mar Khan (Mr. ‘thirty-strikes’ Khan)
तीन में न तेरह में,irrelevant to any group,neither in the three nor in the thirteen
तेल-मसाज करना,to flatter for benefit (colloq.),to do oil massage
थक-हार कर बैठ जाना,to give up after trying,to sit down tired and defeated
थाली का बैंगन बनना,to switch sides easily (opportunist),to become the plate’s eggplant
दिमाग का पारा चढ़ना,to lose temper,the mind’s mercury rising
दिमाग सातवें आसमान पर,to be overconfident or elated,the mind on the seventh sky
दिमाग की बत्ती जलना,to suddenly get an idea,the brain’s lamp lighting
दाँव खेलना,to take a calculated risk,to play a stake
दाँव-पेंच आज़माना,to use tricks or tactics,to try stakes and tricks
नाक में नकेल डालना,to bring someone under strict control,to put a halter in the nose
नाक रगड़ना,to beg desperately,to rub the nose
नाक ऊँची रखना,to uphold one’s honor,to keep the nose high
नाक काट कर रख देना,to disgrace someone completely,to cut off the nose and set it down
नाक पर दम होना,to be short-tempered / easily angered,to have breath on the nose
नाक का बाल होना,to be a favorite / close confidant,to be the hair of the nose
कान खोलकर सुनना,to listen attentively,to listen with ears open
कान देना,to pay attention,to give an ear
कान पकड़ कर माफी मांगना,to apologize earnestly,to hold the ears and ask forgiveness
कान के नीचे देना,to slap / scold sharply,to give a blow beneath the ear
कान में भनक पड़ना,to get a hint of something,for a hint to fall into the ear
कान फटना,to hear loud/harsh sounds,for the ear to tear
कान कतरना,to cheat a little from all sides,to clip the ears
आँख बचाकर निकलना,to slip away unnoticed,to slip out hiding from the eyes
आँखें चार होना,to exchange glances / fall in love,for the eyes to become four
आँखें चुराना,to avoid facing someone,to hide the eyes
आँखें तिरछी करना,to squint in doubt,to make the eyes slant
आँखों पर पट्टी बंधना,to be blinded to the truth,for a bandage to be tied on the eyes
आँखों में बसाए रखना,to cherish someone deeply,to keep (someone) lodged in the eyes
आँखों ही आँखों में इशारा करना,to communicate silently,to signal within the eyes themselves
हाथ आजमाना,to try one’s hand at something,to try the hand
हाथ पक्का होना,to be highly skilled,for the hand to be firm
हाथ कंगन,obvious proof; needs no words,bangle on the hand
हाथ रोक लेना,to restrain oneself,to stop the hand
"हाथी के दाँत खाना और, दिखाना और",hypocrisy; different inside vs outside,the elephant’s teeth are for eating and (others) for showing
हाथ से हाथ धो बैठना,to lose something completely,to wash hand from hand and be left sitting
हाथ धो बैठना,to suffer total loss,to wash one’s hands and sit down
हाथी के पाँव में सबका पाँव,the mighty controls all,"in the elephant’s foot, everyone’s foot"
हाथ पर रखकर देखना,to test practically,to keep it on the hand and see
हाथ टेक देना,to surrender,to place the hands down (in surrender)
पैरों तले की ज़मीन हिलना,to be shocked badly,the ground under the feet to shake
पैर पटकना,to throw a tantrum,to stamp the foot
पैरों पर कुल्हाड़ी चलाना,to self-sabotage,to swing an axe on one’s own feet
पैरों की जूती समझना,to treat with utter disdain,to consider (someone) the shoe of the feet
पैर उखड़ जाना,to lose grip or stability,for the feet to be uprooted
पैरों की बेड़ियाँ,constraints that bind progress,shackles of the feet
पाँव पीछे हटाना,to back out,to move the foot back
पैरों पर खड़ा होना,to become self-reliant,to stand on one’s feet
"मुँह में राम, हाथ में छुरी",to be two-faced,"Ram in the mouth, knife in the hand"
मुँह पर लौकी रखना,to keep completely silent,to place a bottle gourd on the mouth
मुँह मियाँ मिट्ठू,to boast about oneself,mouth’s own ‘Mitthu’ (parrot)
मुँह का कौर छीनना,to snatch someone’s rightful share,to snatch the morsel from the mouth
मुँह का रख लेना,to save face,to keep/save the face of the mouth
मुँह की बात निकल जाना,to blurt something out,the words of the mouth to slip out
माथा ठनकना,to get suspicious suddenly,the forehead to tingle
माथा ठन जाना,to clash over ego,for foreheads to clash
माथे पर लिखना,to be written on one’s fate/forehead,to be written on the forehead
माथा टेकना,to bow in submission,to bow the forehead
दिल का हाल समझना,to understand true feelings,to understand the state of the heart
दिल बड़ा करना,to be generous/forgiving,to make the heart big
दिल छोटा करना,to get discouraged,to make the heart small
दिल बहला फुसलाना,to console and distract,to amuse and cajole the heart
दिल का धनी,large-hearted person,lord/owner of the heart
दिल खोलकर हँसना,to laugh heartily,to laugh with the heart open
दिल लगा कर पढ़ना,to study diligently,to study with the heart attached
दिल हार बैठना,to lose one’s heart (fall in love),to sit having lost the heart
दिमाग ठनकना,to get suspicious,for the brain to tinkle/click
दिमाग चकरा जाना,to get dizzy/confused,the brain to go dizzy
दिमाग ठंडा रखना,to stay calm,to keep the brain cool
दिमाग घिसना,to use brain excessively,to grind/wear down the brain
दिमाग पर जोर डालना,to strain the brain,to put pressure on the brain
दिमाग सातवें आसमान पर होना,to be over the moon / cocky,the brain to be on the seventh sky
दाँत पीसकर रह जाना,to swallow anger silently,to remain gnashing the teeth
दाँत नाखून दिखाना,to show aggression,to show teeth and nails
दाँतों तले अंगुली आ जाना,to be stunned with surprise,for a finger to come under the teeth
दाँत खींच लेना,to break someone’s courage,to pull out the teeth
जुबान चलती रहना,to keep blabbering,the tongue to keep running
जुबान मीठी करना,to speak sweetly to please,to make the tongue sweet
जुबान फँसना,to get tongue-tied,the tongue to get stuck
जुबान दराज़ होना,to be insolent in speech,the tongue to be long
जुबान पर लगाम लगाना,to control speech,to put a bridle on the tongue
कलेजे में आग लगना,to burn with jealousy/grief,for fire to catch in the liver
कलेजे में ठंडक पड़ना,to feel satisfied after justice,for coolness to fall in the liver
खून खौल उठना,to boil with rage,the blood to boil up
खून खून होना,to be very close blood relations,for blood to be blood
खून पिला देना,to torment someone severely,to make (someone) drink blood
खून में दौड़ना,to be in one’s nature,to run in the blood
खून पिघलना,to feel compassion,for the blood to melt
खून मांगना,to demand revenge,to demand blood
पसीना सुखाना,to exploit someone’s hard work,to dry the sweat
पसीना पोछना,to relieve someone’s hardship,to wipe the sweat
पसीना निकाल देना,to scare/work someone badly,to make the sweat come out
रातों की नींद हराम करना,to keep someone sleepless,to make the sleep of nights forbidden
रातों रात भाग्य बदलना,fortune to change overnight,to change fate overnight
रात काटना,to somehow pass a tough night,to cut/pass the night
सिर पर चढ़ बैठना,to take undue advantage of leniency,to climb and sit on the head
सिर पर हाथ रखना,to bless or protect,to place a hand on the head
सिर पर कर्ज़ चढ़ना,to be burdened with debt,for debt to climb onto the head
सिर से पानी गुजरना,to cross all limits / patience,for water to pass over the head
सिर फोड़ लेना,to take all the blame/work alone,to break one’s head
सिर फटना,to get a splitting headache / big fight,for the head to split
सिर घुमाना,to confuse someone,to turn/spin the head
सीना ठोकना,to boast confidently,to thump the chest
सीना चौड़ा होना,to feel proud,for the chest to become broad
सीना फुलाना,to puff up with pride,to inflate the chest
सीने पर पत्थर रखना,to do something painful bravely,to place a stone on the chest
सीने में कील चुभना,to feel deep hurt,for a nail to prick in the chest
छाती पर बोझ रखना,to keep guilt/weight on heart,to place a load on the chest
छाती धौंकनी चलना,to pant with anger/fear,for the chest’s bellows to pump
छाती पर मूँग दल देना,to oppress cruelly,to grind mung beans on the chest
आगाह करना,to warn in advance,to forewarn
आग-बबूला कर देना,to enrage someone greatly,to turn (someone) fire-furious
आग में तपना,to go through severe trials,to be tempered in fire
आग ठंडी कर देना,to pacify anger,to make the fire cool
आग फूँकना,to provoke conflict,to blow the fire
आग लगा बैठना,to cause trouble unknowingly,to set fire and sit (having done it)
आग बुझाना,to resolve a heated situation,to extinguish the fire
आग से निकाल कर राख करना,to ruin after rescuing,to take out from fire and make ash
रंग पकड़ना,to mature or become noticeable,to catch color
रंग उड़ जाना,to lose color/enthusiasm,for color to fly away
रंगत फीकी पड़ना,to look dull/sickly,for the complexion to turn faint
रंग चढ़ना,to intensify (influence/celebration),for the color to mount
रंग बदलते देखना,to witness changing loyalties,to see colors changing
नाक सूँघना,to pry into someone’s matters,to sniff the nose
नाक का बाल बन जाना,to become someone’s favorite,to become the hair of the nose
नाक दबा देना,to silence forcefully,to press the nose down
नाक का पानी उतरना,to be utterly humiliated,for the nose’s water to come down
कान खींचना,to scold/punish strictly,to pull the ear
कान देना-न देना,to ignore what’s being said,to give an ear—or not
कान फूंकना,to warn privately,to blow into the ear
कान पर हाथ धरे रह जाना,to be shocked speechless,to remain with a hand placed on the ear
आँख मिलाना,to meet the gaze confidently,to join/match eyes
आँख नीची करना,to lower eyes in shame,to lower the eyes
आँखें झुकाना,to be modest/shy,to cast the eyes down
आँखें तरेर कर देखना,to glare angrily,to look by glaring the eyes
आँखें चमक उठना,to become excited,for the eyes to light up
आँखें नम होना,to get teary-eyed,for the eyes to become moist
आँखें धोखा खा जाना,to be visually deceived,for the eyes to be deceived
आँख का तारा,apple of the eye,the star of the eye
आँख का तिल,someone extremely dear,the mole/beauty-spot of the eye
हाथ से काम निकलना,to get work done by others,for work to come out from the hand
हाथ गंदा करना,to do dirty/lowly work,to make the hand dirty
हाथ पर नाग रखना,to sit idle doing nothing,to keep a snake on the hand
हाथ डूबना,to sink resources into loss,for the hand to drown
हाथ थामे रह जाना,to stay dependent,to remain holding the hand
हाथ काटकर अलग करना,to sever ties completely,to cut off the hand and separate
पाँव धरना,to set foot (begin),to set/place the foot
पाँव पसारकर सोना,to relax without worry,to sleep with feet stretched out
पाँव फिसलना,to make a slip/mistake,for the foot to slip
पाँव भारी होना,to be pregnant (euphemistic),for the foot to be heavy
पाँव के नीचे से जमीन खींच लेना,to pull the rug from under,to pull the ground from under the feet
पाँव तले रौंदना,to crush mercilessly,to crush under the feet
पाँव रोक देना,to restrain someone,to stop the foot
मुँह फुलाना,to sulk,to puff the mouth
मुँह पर ताला लगाना,to stay tight-lipped,to put a lock on the mouth
मुँह तक आकर लौट जाना,to almost say but stop,to come up to the mouth and turn back
मुँह फूटना,to blurt under pressure,for the mouth to burst (into speech)
मुँह के बल गिरना,to fail badly,to fall face-first
मुँह-माँगा दाम,price asked without bargaining,price asked by the mouth
मुँह में खून लगना,to become greedy after first gain,to get blood in the mouth
मुँह में लौकी डालना,to hush someone completely,to put a bottle gourd in the mouth
मुँह का स्वाद बदलना,to lighten the mood,to change the taste of the mouth
माथा ठोककर मानना,to accept with resignation,to accept by knocking the forehead
माथे का पसीना पोंछना,to finish hard work,to wipe the sweat of the forehead
माथे की लकीरें,lines of fate/concern,lines on the forehead
माथे पे शिकन,wrinkles of worry,wrinkles on the forehead
माथा घूम जाना,to feel dizzy/overwhelmed,for the head/forehead to spin
माथे पर हाथ मारना,to smack the forehead in regret,to strike the hand on the forehead
दिल दहला देना,to horrify,to make the heart tremble
दिल में घर कर लेना,to make a place in one’s heart,to make a home in the heart
दिल पर चोट लगना,to be emotionally hurt,to have a blow strike the heart
दिल पे लेना-न लेना,to take/not take to heart,to take on the heart—or not
दिल का रोग,heartache/grief,disease of the heart
दिल की बात कहना,to confide,to say the heart’s matter
दिमाग घूम जाना,to get furious or confused,the mind spinning
दिमाग पर पत्थर रखना,to force oneself against feelings,to place a stone on the brain
दिमाग में कील ठोकना,to insist hard on a point,to hammer a nail into the brain
दिमाग की नस दबना,to lose calm badly,for the brain’s vein to be pressed
दिमाग ठप्प होना,to have a mental block,for the brain to be shut down
दाँत दिखाना-न दिखाना,to mock or avoid mocking,to show the teeth—or not show
दाँत लगना,to become accustomed (badly),for the teeth to catch
दाँत भींचना,to endure silently,to clench the teeth
दाँत की नोक पर रखना,to remember exactly,to keep on the tip of the tooth
दाँत-काटे का बैर,deadly enmity,tooth-bitten enmity
जुबान की मिठास,sweetness of speech,sweetness of the tongue
जुबान सरकना,to slip of the tongue,for the tongue to slip
जुबान की धार,sharpness of words,the edge/blade of the tongue
जुबान को ताला,to keep silent,a lock to the tongue
खून खौल जाना,to boil with rage,for the blood to boil
खून सूख जाना,to be terrified or horrified,for the blood to dry up
खून पीना,to exploit harshly,to drink blood
खून के आँसू रोना,to suffer painfully,to cry tears of blood
पसीना चूना,to toil severely,for sweat to drip
पसीना टपकना,to sweat profusely,for sweat to drip
पसीना रोक देना,to relieve / cool down,to stop the sweat
सीने में साँप लोटना,to be eaten up by jealousy,for a snake to roll in the chest
सीने-से-लगाना,to embrace warmly,to press to the chest
सीना-जोरी करना,to browbeat,to do chest-force (browbeating)
सीने में धुआँ उठना,to smolder with anger,for smoke to rise in the chest
आग सलाख करना,to test by ordeal,to do a fire-rod ordeal
आग में घिरना,to be surrounded by trouble,to be surrounded in fire
आग सेंकना,to take advantage amid conflict,to warm oneself at the fire
आग ओकना,to speak venomously,to spew fire
आग बुझा बैठना,to lose spirit prematurely,to sit having put out the fire
रंग में रंग जाना,to blend in completely,to be colored in the same color
रंग उछालना,to malign someone publicly,to fling/throw color
रंगत लौटना,to regain glow/cheer,for the complexion to return
नाक घुसाना,to interfere unnecessarily,to insert the nose
नाक मरोड़ना,to insult or humiliate publicly,to twist the nose
नाक पर गुस्सा होना,to get angry quickly,to have anger on the nose
नाक नीचे करना,to make someone feel inferior,to put the nose down
नाक का बाल खींचना,to criticize harshly,to pull the hair of the nose
कान में भनक लगना,to get a small hint about something,for a hint/buzz to catch in the ear
कान में फूँक मार देना,to secretly manipulate someone,to blow a puff into the ear
कान पकड़े रह जाना,to stay astonished or scared,to remain holding the ears
कान के नीचे थप्पड़ मारना,to slap soundly (figuratively punish),to slap below the ear
कान में सीटी बजना,to hear unpleasant sounds / tinnitus,for a whistle to sound in the ear
आँखों से आँसू पोछना,to comfort someone in sorrow,to wipe tears from the eyes
आँखों में बसा लेना,to remember fondly,to lodge/settle in the eyes
आँखें फेर लेना,to turn away / stop supporting,to turn the eyes away
आँख मूँदकर भरोसा करना,to trust blindly,to trust with eyes closed
आँखों के आगे अंधेरा छा जाना,to be momentarily shocked,for darkness to spread before the eyes
आँख बचाकर काम करना,to do secretly,to do the work after evading the eyes
आँख खुलना,to become aware of truth,for the eye to open
आँखों में आँसू भर आना,to feel deeply emotional,for tears to fill the eyes
आँखें नीची करना,to bow in embarrassment or respect,to lower the eyes
हाथ तंग होना,to be financially tight,for the hands to be tight
हाथ ऊपर होना,to be superior in status or strength,for the hand to be above
हाथ नीचे होना,to lose or be defeated,for the hand to be below
हाथ जोड़ना,to plead or show respect,to join the hands
हाथ में काम न होना,to be idle,to have no work in the hand
हाथ न लगाना,to avoid touching / involvement,to not touch with the hand
हाथ छुड़ाना,to escape from control,to pull the hand free
हाथ रोक देना,to stop mid-action,to stop the hand
पैर रखना भी पाप,to be forbidden to enter,even to set foot is a sin
पैर जमने न देना,to obstruct someone’s progress,to not let the feet set
पैर पर पाँव रखना,to challenge or overtake,to place foot upon foot
पैरों में गिरना,to beg for mercy,to fall at the feet
पैर भारी होना,to bring bad luck (figuratively),for the foot to be heavy
पैर धोना,to show deep respect,to wash the feet
पैर पकड़ लेना,to surrender humbly,to catch/hold the feet
पैर रोक लेना,to hesitate before action,to hold back the foot
मुँह मोड़ लेना,to turn away emotionally,to turn the mouth/face aside
मुँह बंद कर देना,to silence completely,to shut the mouth
मुँह चलाना,to speak unnecessarily,to run the mouth
मुँह लगाना,to get too familiar with elders,to put (someone) to the mouth
मुँह मीठा होना,to taste success,for the mouth to become sweet
मुँह बिचकाना,to show irritation or disgust,to pucker/twist the mouth
मुँह पीटना,to cry loudly in distress,to beat the mouth/face
मुँह धुलवाना,to publicly humiliate,to have the mouth/face washed
माथे पर शिकन डालना,to frown slightly,to put a crease on the forehead
माथे पर लकीरें पड़ना,to show anxiety or anger,for lines to fall on the forehead
दिल में जगह बनाना,to win affection,to make a place in the heart
दिल में काँटे चुभना,to feel deeply hurt,for thorns to prick in the heart
दिल में खटका होना,to have a lingering doubt,for a jolt/unease to be in the heart
दिल में गुस्सा रखना,to hold a grudge,to keep anger in the heart
दिल की गहराई से,from the bottom of one’s heart,from the depth of the heart
दिल हिल जाना,to be shaken emotionally,for the heart to shake
